full_name,topic_key,quote_text,source_url,source_name
Karen Bass,healthcare,"No one in this country should go bankrupt because they got sick. Healthcare is a right, and I am proud to support Medicare for All. We need a system that puts patients before profits and ensures every American has access to the care they need.",https://www.congress.gov/member/karen-bass/B001270,U.S. House Member Page
Karen Bass,deportation,"Mass deportations do not make our communities safer. They destroy families, create fear, and undermine the trust between immigrant communities and local law enforcement. Los Angeles will not be a partner in this cruelty.",https://www.congress.gov/member/karen-bass/B001270,U.S. House Member Page
Karen Bass,voting-rights,"The right to vote is the cornerstone of our democracy. We cannot allow partisan efforts to suppress the vote to stand unchallenged. The For the People Act and the John Lewis Voting Rights Advancement Act are essential to protecting every American's right to participate in our democracy.",https://www.congress.gov/member/karen-bass/B001270,U.S. House Member Page
Todd Young,same-sex-marriage,"The Respect for Marriage Act is consistent with my view that government shouldn't be in the business of telling people who they can love and who they can marry. I believe in limited government and individual liberty, and that applies here.",https://www.congress.gov/bill/117th-congress/senate-bill/4556,U.S. Congress — Respect for Marriage Act (S. 4556)
Todd Young,ai-regulation,"The CHIPS and Science Act is about making sure America leads the world in the industries of the future — not just semiconductors, but artificial intelligence, quantum computing, and advanced manufacturing. We have to out-compete China, and this is how we do it.",https://www.congress.gov/bill/117th-congress/senate-bill/4749,U.S. Congress — CHIPS and Science Act (S. 4749)
Todd Young,tariffs,"Trade agreements like the USMCA are the right way to open markets and protect American workers — not unilateral tariffs that invite retaliation and hurt Indiana's farmers, manufacturers, and exporters.",https://www.congress.gov/bill/116th-congress/house-bill/5430,U.S. Congress — USMCA Implementation Act (H.R. 5430)
Todd Young,ukraine-support,"America must stand with our allies against aggression. The bipartisan national security supplemental we passed sends a clear message to Vladimir Putin: we will not abandon democracy in Ukraine, we will not allow him to redraw the map of Europe by force.",https://www.congress.gov/bill/118th-congress/senate-bill/4109,U.S. Congress — Emergency National Security Supplemental (S. 4109)
Todd Young,abortion,"I am pro-life. I have consistently voted to protect the unborn and to ensure taxpayer dollars are not used to fund abortions. These are core commitments I brought to the Senate and will continue to uphold.",https://www.congress.gov/bill/117th-congress/senate-bill/4132,U.S. Congress — Women's Health Protection Act (S. 4132)
Todd Young,trans-athletes,"Protecting women's sports means ensuring that girls and women compete on a level playing field. The Protection of Women and Girls in Sports Act reflects a principle that I think most Americans share — biological sex matters in athletic competition.",https://www.congress.gov/bill/117th-congress/senate-bill/2617,U.S. Congress — Protection of Women and Girls in Sports Act (S. 2617)
Todd Young,immigration,"I support border security and an orderly legal immigration system. Indiana's economy depends on legal pathways for workers and on enforcing the laws we have. We need comprehensive reform that secures the border first.",https://www.congress.gov/member/todd-young/Y000064,U.S. Senate Member Page
Jim Banks,ukraine-support,"I voted no on the Ukraine supplemental because American taxpayers should not be writing blank checks to foreign governments when we have unsecured borders at home and record debt. America First means we take care of America first.",https://www.congress.gov/vote/118th-congress/house/107,U.S. Congress — House Vote 107 (118th Congress)
Jim Banks,abortion,"The No Taxpayer Funding for Abortion Act is simple: Americans who oppose abortion on moral and religious grounds should not be compelled to pay for it. Life begins at conception, and I will defend the unborn in every piece of legislation that comes before me.",https://www.congress.gov/bill/117th-congress/house-bill/18,U.S. Congress — No Taxpayer Funding for Abortion Act (H.R. 18)
Jim Banks,trans-athletes,"I introduced the Protection of Women and Girls in Sports Act because this is not a complicated issue. Women's sports exist to give women an equal competitive opportunity. Allowing biological males to compete destroys that. I will keep fighting until this is federal law.",https://www.congress.gov/bill/117th-congress/house-bill/426,U.S. Congress — Protection of Women and Girls in Sports Act (H.R. 426)
Jim Banks,civil-rights,"The POLICE Act is a real alternative to the radical defund movement. It funds law enforcement, keeps communities safe, and holds bad actors accountable without painting every officer as a racist. We can have both accountability and respect for the men and women in blue.",https://www.congress.gov/bill/117th-congress/house-bill/3889,U.S. Congress — POLICE Act (H.R. 3889)
Jim Banks,same-sex-marriage,"Marriage is defined in the Bible and across human civilization as the union of a man and a woman. That is my sincere religious conviction and I will always vote to defend it. The Respect for Marriage Act is an attack on traditional marriage and I voted against it.",https://www.congress.gov/bill/117th-congress/senate-bill/4556,U.S. Congress — Respect for Marriage Act (S. 4556)
Jim Banks,taxes,"The Tax Cuts and Jobs Act delivered real relief to working families and small businesses across Indiana. We need to make those cuts permanent. Every dollar that stays in the hands of Hoosiers is a dollar that creates jobs and builds our economy.",https://www.congress.gov/bill/115th-congress/house-bill/1,U.S. Congress — Tax Cuts and Jobs Act (H.R. 1)
Jim Banks,immigration,"The crisis at our southern border is not an accident — it is the result of deliberate policy choices by the Biden administration to ignore the law. We need to finish the wall, reinstate Remain in Mexico, and enforce the laws on the books. That is the America First approach to immigration.",https://www.congress.gov/member/james-banks/B001299,U.S. Senate Member Page
